{
  "$schema": "./public-sdk-surface.schema.json",
  "catalogVersion": "0.3.0",
  "openApi": "../src/Vyral.Server/contracts/vyral.openapi.json",
  "openApiVersion": "3.1.0",
  "evidenceProfiles": {
    "public-sdk": {
      "server": "tests/Vyral.Tests.Local/ServerWorkflowTests.cs",
      "pythonWire": "clients/python/tests/test_client.py",
      "pythonDocs": "clients/python/README.md",
      "javascriptWire": "clients/javascript/test/index.test.js",
      "javascriptDocs": "clients/javascript/README.md"
    }
  },
  "excludedRestOperations": [
    {
      "operationId": "getServerInfo",
      "reason": "Human-readable server banner; health and contract discovery are the supported SDK operations."
    }
  ],
  "operations": [
    {
      "id": "listCanonicalMigrations",
      "group": "canonical",
      "restOperationIds": [
        "listCanonicalMigrations"
      ],
      "stability": "public",
      "authorizationClass": "canonical-policy",
      "mutation": "read",
      "completionBoundary": "non-mutating",
      "idempotency": "not-applicable",
      "sdk": {
        "python": "list_canonical_migrations",
        "javascript": "listCanonicalMigrations"
      },
      "contractRefs": [
        "openapi:listCanonicalMigrations"
      ],
      "schemaRefs": [
        "#/components/schemas/CanonicalMigrationReceipt"
      ],
      "mcp": {
        "exposure": "none",
        "id": null,
        "defaultEnabled": false
      },
      "headerSafeFields": [],
      "evidenceProfile": "public-sdk"
    },
    {
      "id": "applyCanonicalMigrations",
      "group": "canonical",
      "restOperationIds": [
        "applyCanonicalMigrations"
      ],
      "stability": "public",
      "authorizationClass": "canonical-policy",
      "mutation": "write",
      "completionBoundary": "atomic",
      "idempotency": "unsupported",
      "sdk": {
        "python": "apply_canonical_migrations",
        "javascript": "applyCanonicalMigrations"
      },
      "contractRefs": [
        "openapi:applyCanonicalMigrations"
      ],
      "schemaRefs": [
        "#/components/schemas/CanonicalMigration"
      ],
      "mcp": {
        "exposure": "none",
        "id": null,
        "defaultEnabled": false
      },
      "headerSafeFields": [],
      "evidenceProfile": "public-sdk"
    },
    {
      "id": "preflightCanonicalStore",
      "group": "canonical",
      "restOperationIds": [
        "preflightCanonicalStore"
      ],
      "stability": "public",
      "authorizationClass": "canonical-policy",
      "mutation": "read",
      "completionBoundary": "non-mutating",
      "idempotency": "not-applicable",
      "sdk": {
        "python": "get_canonical_preflight",
        "javascript": "getCanonicalPreflight"
      },
      "contractRefs": [
        "openapi:preflightCanonicalStore"
      ],
      "schemaRefs": [
        "#/components/schemas/CanonicalPreflightReport"
      ],
      "mcp": {
        "exposure": "none",
        "id": null,
        "defaultEnabled": false
      },
      "headerSafeFields": [],
      "evidenceProfile": "public-sdk"
    },
    {
      "id": "probeCanonicalStoreDataPlane",
      "group": "canonical",
      "restOperationIds": [
        "probeCanonicalStoreDataPlane"
      ],
      "stability": "public",
      "authorizationClass": "canonical-policy",
      "mutation": "write",
      "completionBoundary": "maintenance",
      "idempotency": "unsupported",
      "sdk": {
        "python": "probe_canonical_data_plane",
        "javascript": "probeCanonicalDataPlane"
      },
      "contractRefs": [
        "openapi:probeCanonicalStoreDataPlane"
      ],
      "schemaRefs": [
        "#/components/schemas/CanonicalPreflightReport"
      ],
      "mcp": {
        "exposure": "none",
        "id": null,
        "defaultEnabled": false
      },
      "headerSafeFields": [],
      "evidenceProfile": "public-sdk"
    },
    {
      "id": "commitCanonicalTransaction",
      "group": "canonical",
      "restOperationIds": [
        "commitCanonicalTransaction"
      ],
      "stability": "public",
      "authorizationClass": "canonical-policy",
      "mutation": "write",
      "completionBoundary": "atomic",
      "idempotency": "required",
      "sdk": {
        "python": "commit_canonical_transaction",
        "javascript": "commitCanonicalTransaction"
      },
      "contractRefs": [
        "openapi:commitCanonicalTransaction"
      ],
      "schemaRefs": [
        "#/components/schemas/CanonicalTransactionRequest",
        "#/components/schemas/CanonicalTransactionResult"
      ],
      "mcp": {
        "exposure": "none",
        "id": null,
        "defaultEnabled": false
      },
      "headerSafeFields": [],
      "evidenceProfile": "public-sdk"
    },
    {
      "id": "readCanonicalDocument",
      "group": "canonical",
      "restOperationIds": [
        "readCanonicalDocument",
        "getCanonicalDocument"
      ],
      "stability": "public",
      "authorizationClass": "canonical-policy",
      "mutation": "read",
      "completionBoundary": "non-mutating",
      "idempotency": "not-applicable",
      "sdk": {
        "python": "get_canonical_document",
        "javascript": "getCanonicalDocument"
      },
      "contractRefs": [
        "openapi:readCanonicalDocument",
        "openapi:getCanonicalDocument"
      ],
      "schemaRefs": [
        "#/components/schemas/CanonicalDocument",
        "#/components/schemas/CanonicalDocumentReadRequest"
      ],
      "mcp": {
        "exposure": "none",
        "id": null,
        "defaultEnabled": false
      },
      "headerSafeFields": [],
      "evidenceProfile": "public-sdk"
    },
    {
      "id": "queryCanonicalDocuments",
      "group": "canonical",
      "restOperationIds": [
        "queryCanonicalDocuments"
      ],
      "stability": "public",
      "authorizationClass": "canonical-policy",
      "mutation": "read",
      "completionBoundary": "non-mutating",
      "idempotency": "not-applicable",
      "sdk": {
        "python": "query_canonical_documents",
        "javascript": "queryCanonicalDocuments"
      },
      "contractRefs": [
        "openapi:queryCanonicalDocuments"
      ],
      "schemaRefs": [
        "#/components/schemas/CanonicalDocumentQuery",
        "#/components/schemas/CanonicalDocumentQueryResult"
      ],
      "mcp": {
        "exposure": "none",
        "id": null,
        "defaultEnabled": false
      },
      "headerSafeFields": [],
      "evidenceProfile": "public-sdk"
    },
    {
      "id": "queryCanonicalDocumentRevisions",
      "group": "canonical",
      "restOperationIds": [
        "queryCanonicalDocumentRevisions",
        "listCanonicalDocumentRevisions"
      ],
      "stability": "public",
      "authorizationClass": "canonical-policy",
      "mutation": "read",
      "completionBoundary": "non-mutating",
      "idempotency": "not-applicable",
      "sdk": {
        "python": "list_canonical_document_revisions",
        "javascript": "listCanonicalDocumentRevisions"
      },
      "contractRefs": [
        "openapi:queryCanonicalDocumentRevisions",
        "openapi:listCanonicalDocumentRevisions"
      ],
      "schemaRefs": [
        "#/components/schemas/CanonicalDocumentRevision",
        "#/components/schemas/CanonicalDocumentRevisionQuery"
      ],
      "mcp": {
        "exposure": "none",
        "id": null,
        "defaultEnabled": false
      },
      "headerSafeFields": [],
      "evidenceProfile": "public-sdk"
    },
    {
      "id": "leaseCanonicalOutbox",
      "group": "canonical",
      "restOperationIds": [
        "leaseCanonicalOutbox"
      ],
      "stability": "public",
      "authorizationClass": "canonical-policy",
      "mutation": "write",
      "completionBoundary": "atomic",
      "idempotency": "unsupported",
      "sdk": {
        "python": "lease_canonical_outbox",
        "javascript": "leaseCanonicalOutbox"
      },
      "contractRefs": [
        "openapi:leaseCanonicalOutbox"
      ],
      "schemaRefs": [
        "#/components/schemas/CanonicalOutboxLease",
        "#/components/schemas/CanonicalOutboxLeaseRequest"
      ],
      "mcp": {
        "exposure": "none",
        "id": null,
        "defaultEnabled": false
      },
      "headerSafeFields": [],
      "evidenceProfile": "public-sdk"
    },
    {
      "id": "queryCanonicalOutbox",
      "group": "canonical",
      "restOperationIds": [
        "queryCanonicalOutbox"
      ],
      "stability": "public",
      "authorizationClass": "canonical-policy",
      "mutation": "read",
      "completionBoundary": "non-mutating",
      "idempotency": "not-applicable",
      "sdk": {
        "python": "query_canonical_outbox",
        "javascript": "queryCanonicalOutbox"
      },
      "contractRefs": [
        "openapi:queryCanonicalOutbox"
      ],
      "schemaRefs": [
        "#/components/schemas/CanonicalOutboxQuery",
        "#/components/schemas/CanonicalOutboxQueryResult"
      ],
      "mcp": {
        "exposure": "none",
        "id": null,
        "defaultEnabled": false
      },
      "headerSafeFields": [],
      "evidenceProfile": "public-sdk"
    },
    {
      "id": "renewCanonicalOutboxLease",
      "group": "canonical",
      "restOperationIds": [
        "renewCanonicalOutboxLease"
      ],
      "stability": "public",
      "authorizationClass": "canonical-policy",
      "mutation": "write",
      "completionBoundary": "atomic",
      "idempotency": "unsupported",
      "sdk": {
        "python": "renew_canonical_outbox_lease",
        "javascript": "renewCanonicalOutboxLease"
      },
      "contractRefs": [
        "openapi:renewCanonicalOutboxLease"
      ],
      "schemaRefs": [
        "#/components/schemas/CanonicalOutboxLeaseRenewal",
        "#/components/schemas/CanonicalOutboxLeaseRenewalRequest"
      ],
      "mcp": {
        "exposure": "none",
        "id": null,
        "defaultEnabled": false
      },
      "headerSafeFields": [],